index,Name,Release date,Price,Average playtime forever,Developers,Publishers,Genres,About the game,Estimate users,Estimated gross profit,Review score,Total days,Extras trophy,Operating System,year
39608,Castaway Paradise - live among the animals,2015-05-19,14.99,270,Stolen Couch Games,Stolen Couch Games,"Adventure,Casual,Indie,RPG,Simulation","Your adventure starts when you get stranded on a tropical island. This is your island, your adventure! Do whatever you like! It's the ultimate Sandbox sim! Do you like Animal Crossing or Harvest Moon? Castaway Paradise is the game for you! Full controller support added in version 3.0! FUN ACTIVITIES You can spend your days doing fun activities such as catching bugs and fishing. Try to make a bigger catch than your friends and make your collections complete! GROW PLANTS Farm your own home-grown fresh crops! Rake the ground, plant the seeds and give them some water. You can also decorate your island with beautiful plants and flowers or grow fruit trees. CREATE YOUR OWN OUTFIT Endlessly combine outfits, hats, dresses, shoes and other clothing to reflect your personality, or create a funny outfit just for the laughs! DECORATE YOUR ISLAND After the devastating storm, the island needs some renovation! You can place items from a lot of different theme packs and make the island your idea of paradise! You can be Among the things that you like! Don't forget to send Us a screenshot of your decorations. HELP THE VILLAGERS OUT You are among quirky villagers and help them by engaging on quests for them. They will reward you with great gifts! You can also just chat with them to get to know them better. HOLIDAYS AND EVENTS Throughout the year, special events and holidays will occur like Christmas and Halloween. Among them there is the winter holidays for example, the island will be covered in snow, and you can help the villagers by decorating all the houses and the rest of the island.",564,8454.36,247,3148,47,True,2015
38470,TRIP Steam Edition,2015-06-19,4.99,131,Xenon,Xenon,"Adventure,Casual,Indie,Simulation","TRIP is a self-described 'artware' A 3D art platform to be periodically updated with virtual art installations ( 3D explorable art sets ) These virtual sets will feature works and music by the artist as a theme, aesthetic, or idea solidified in 3D form and fully explorable. TRIP is for those looking for an artistic and abstract experience without the demand for an objective. Here are some screens from the upcoming content batch",291,1452.09,-18,3117,0,True,2015
55219,Assault Corps 2,2015-07-15,2.99,0,AOS GAME,AOS GAME,"Action,Adventure,Casual,Indie,Massively Multiplayer,Racing,RPG,Simulation,Sports,Strategy","'Assault Corps 2” is an online real-time strategy 3D game with more innovative playing methods. The game allows players to participate in multiplayer races as controllers of various weapons units. In battle, players must be ready to rotate their angle of view and skillfully choose ammunitions to kill the enemy. Each weapon has its own unique skills and it is an important basis for players to use the skills reasonably to get victory. Simulating modern military equipment confrontations constitutes the core of the game and multiplayer race, team race, BOSS and many other playing modes are available for your choice. The game attaches great importance to collaborations among players and truly allows tens of thousands of people to take part in races under the same server. Game features: - multiplayer cooperation RTS game, maximum support 8 vs 8 in battle - base construction: research tech、strengthen lethal ammunition、ore production... - 11 different maps, more maps are being prepared. - 13 kinds of game modes, such as resource war、towe defense、boss challenge... - 18 kinds of combat units, include combat robot、infantry fighting vehicle、tank、 self-propelled gun、mech、 helicopter、plane、 gunship ... - 18 kinds of technology components. You can enhance the combat unit's armor, speed, fire power and survivability. - 18 kinds of skills. Each unit has its own unique skill, rational use they can make you even more powerful in battle!",43,128.57000000000002,-13,3091,0,True,2015
1679,Amos From Outer Space,2015-10-06,2.99,0,Poisson Rouge Interactica ltd,Poisson Rouge Interactica ltd,Casual,"An interactive audio-visual experience for children aged 1 to 8. Amos is just a kid. Nobody knows where he is from... or where he is going. But you can join him on his adventures in this colourful journey. Brought to you by the creators of Poisson Rouge...Red Fish for kids. All set to the original sounds and music from King of the Rocket Men. Four interactive stories, a film, a comic and a whole load of games and activities. Is there an educational purpose to it all? Is there an educational purpose to life? Just sit back and enjoy... 4 point and click interactive adventures Amos and the UFO Amos and the cow Amos and the beanstalk Amos and the door Shooting galleries Get out your colour gun and colour three animated scenes. Math Planets 14 planets each with its own problems to solve Find the alien The alien is hiding in one of the UFOs Dot to Dot stars A join the stars Jigsaw puzzles Costume clones Bugs! A whole set on insecty games Dancing cows music mixer Optical illusions Sound effects machine Penguin choir Fishing eskimo Symmetry colouring Under-water adventure An interactive soundscape. Play with the fish Comic book A 48 page interactive comic book. The movie A 21 minute long animated short of the intrepid space explorer and his adventures.",8,23.92,6,3008,0,True,2015
7722,Microcosmum: survival of cells,2015-07-24,7.99,215,Satur Entertainment,Satur Entertainment,"Action,Casual,Indie,RPG,Simulation,Strategy",Microcosmum: survival of cells - real-time strategy game with a relaxing atmosphere and original gameplay. Join the wonderful and amazing world of microorganisms. Become part of a natural selection in the microcosm. Enjoy the atmospheric music and this beautiful world. Relaxing gameplay and the whole atmosphere will let you lose yourself in the game. The freedom of control will let you create a large amount of different strategic manoeuvres. Become the only winner in this battle for survival. The aim is to catch all your opponents. Improve your microorganisms to make them stronger. Attack and catch your opponents using parts of your microorganisms. Your way to victory lies through the circumspected strategy. • High-quality graphics • The originality of the gameplay • Original game setting • Full freedom control • Opportunity for strategic maneuvers • 72 levels,1277,10203.23,876,3082,20,True,2015
23947,Blood Code,2015-12-28,9.99,476,"ZiX Solutions,Weixi Studio",ZiX Solutions,"Adventure,Casual,Indie,Simulation,Strategy","In order to better shape my future, I came to a strange city alone seeking to attain knowledge. However, this happiness could not be shared with my father, whom I had recently learned died in an accident. Helplessness and panic, It is my choice... But the reality weighed heavy on my heart Accidental deaths are rarely an accident... Could someone, once a friend, perhaps be the murderer? Who is the killer... What should I do... What is the purpose of the Holy See? What secrets are held by the Bloodline? At the end who is the real boss? Key Features This is an otome dating simulation (male romantic paths). Make your own schedule! Arrange your studies, work part-time jobs, or just seek out some entertainment. More interaction! - Talking is not the only way that you gain intimate links with handsome boys... You can make your gaming experience better by going on dates and sending gifts! Nearly 40 gorgeous CGs combine with the remarkable plots to bring you into the world of magic and wonder. Original Soundtrack featuring 10+ tracks! Multiple endings. The choices you make matter!",2026,20239.74,946,2925,31,True,2015
7514,PANORAMICAL,2015-09-17,9.99,0,"Fernando Ramallo,David Kanaga",Finji,Indie,"Prepare your fragile human mind for PANORAMICAL, an interactive sensory journey unlike anything you’ve ever played before. Manipulate the look, sound, and feel of more than a dozen mesmerizing landscapes in this immersive musical adventure through space and time. Turn peaceful mountains into thumping valleys into jazz solo forests into ominous caves, turn day into night, turn oceans into deserts into atmosphere and the soundscape transforms with you. Each of the 15 unique worlds consists of 18 different audio-visual dimensions under your control. Explore the shifting and ethereal universe of PANORAMICAL at your own pace. It’s easy to learn and easy to play, with straightforward controls compatible with keyboard + mouse, gamepad, and even MIDI controllers. Play PANORAMICAL however you want: summon dreamlike landscapes with the push of a button, chase that perfect beat, or just find a place where you can relax. Let it all go, or climb into a rainbow dome at the top of the world and ride a serpentine turquoise mountain into a beautiful magenta oblivion. It’s up to you. 15 unique environments, ranging from abstract to concrete, from meditative to explosive technicolor madness, and everything in between. Dynamic interactive music by David Kanaga, the award-winning musician behind Proteus and Dyad. Special collaborator environments produced by an international team of designers and musicians behind titles like FRACT, Pixeljunk Eden, Samurai Gunn, Nuclear Throne, and others. Capture pictures and videos and share your favourite moments from inside the game. Unique 18-dimensional analog controls: Every combination produces a new audiovisual space. Compatible with keyboard+mouse, gamepads and MIDI controllers.",204,2037.96,162,3027,0,True,2015
40051,Bard to the Future,2015-02-27,0.0,0,Battlebard Games,Battlebard Games,"Action,Adventure,Indie","Bard to the Future is a side scrolling 2D platformer which follows a medieval battlebard as he finds a time machine, meets two LARPers and ends up in a race against a time travelling cyborg pirate to discover a lost treasure. Players will have to jump and powerslide through several time periods to complete the journey. Each time period brings new environmental factors, unique enemies and varying difficulty - from the slippery grounds of the Ice Age to the resurrected mummies of Ancient Egypt. Enjoy Bard to the Future's unique sound track, immersive story and lovable characters in a comical Story Mode adventure - or try a speedy play-through in Time Trial mode. Features Story Mode - spanning 7 time periods and 26 levels! Time Trial Mode across all levels! Challenging Boss fights! Steam Cloud Save Original Soundtrack and voice work!",70,0.0,-6,3229,13,True,2015
11835,A Wolf in Autumn,2015-10-27,1.99,89,David Szymanski,David Szymanski,"Adventure,Indie","After escaping from a locked shed, a young girl finds herself in the middle of an idyllic autumn forest. At first her surroundings seem peaceful, and she's comforted by her mother's voice coming through a strange tin device. But gradually, things begin to turn disturbing and sinister. And the distant howling of wolves begins to move closer... A Wolf in Autumn is a dark, surreal psychological horror game, from the developer of Fingerbones , The Moon Sliver , and The Music Machine . It focuses on creating a short engaging horror experience that relies on narrative, pacing, context, and atmosphere rather than jump scares. Voice acting by Julie Hoverson FEATURES Puzzles can be solved using real-world logic, often in several different ways. A twisting psychological experience using a combination of gameplay interaction and narrative. A diverse set of influences, including 'The Sound and The Fury,' 'Silent Hill 2,' and 'Mulholland Drive.' Modeling, music, environments, and programming were done from scratch. Textures were based off of stock photos ( / ). Sound effects were manufactured from creative commons samples. Intended to be completed in a single sitting of around 1 hour. It does not feature a save system. Deals with potentially disturbing themes. Free copy of the full original soundtrack is included Designed and optimized to run on the recommended hardware.",311,618.89,148,2987,0,True,2015
42948,Vendetta - Curse of Raven's Cry,2015-11-20,29.99,364,Reality Pump Studios,"TopWare Interactive,ACE","Action,Indie,RPG","In the darkest corners of the Caribbean, an old evil is rising again. It's been years since Christopher Raven's family was brutally murdered by Neville “the Devil” Scranton and his bloodthirsty gang, the Devil's Tines. Orphaned and missing a hand, Christopher is rescued by Marcus, an ex-slave and rum-maker who nurses Christopher back to health and takes him under his wing. Growing up with a black bitterness in his heart, Christopher drowns his demons in rum and violence, brooding endlessly on the revenge that was stolen from him when the Devil’s Tines disappeared in the monstrous quake that sunk half of Port Royal. When a string of brutal and all too familiar murders occur, Christopher’s chance for revenge is suddenly within his grasp. Neville and the Tines are back, and nothing on earth will stop Christopher from claiming their heads. CONTENT OF THE DIGITAL DELUXE EDITION A brand new location waiting to be explored, with additional 60 minutes of playing time Two exclusive in-game items: the Grim Ripper figurehead and the mighty cutlass 'Merciless'. Both exclusive in-game items increase the respective abilities of Christopher and his ship when used The digital Artbook: Enjoy 72 packed pages of original Raven's Cry artwork (PDF Format) An extended version of the Official Soundtrack (MP3 Format) All classic pirate songs, including Whisky in a Jar, Hanging Willie aka Drunken Sailor, La Bamba, Da-YO aka Bananaboat Song and more A digital Songbook including all of the Tavern songs with both the lyrics and the musical notes (PDF Format) Exclusive Wallpapers GAMEPLAY Vendetta: Curse of Raven’s Cry is a third person, open world action-RPG that combines fast-paced swordplay with thrilling naval battles and exploration. Assume the role of dread pirate Christopher Raven and take your revenge on Captain Neville Scranton and the men who killed your family. Loot, sail, shoot and stab your way through myriad missions and side-quests, and explore the sprawling West Antilles by land or by sea. Hand pick your crew, upgrade your skills and your ship, and gain a reputation for either savagery or mercy, influencing how your friends and foes interact with you. Every choice has a price, and your decisions will bring you closer to your ultimate revenge. Getting there with your soul intact is up to you. FEATURES A Brutal World: Dozens of missions and side-quests are spread across the 18th century Caribbean. From white, sandy beaches crawling with deadly wildlife to dark and stormy seas infested with pirates, the world is your battleground. Know Your Enemy: Hundreds of colorful characters await you; pirate gangs, cannibals, government factions and even ferocious wildlife all stand in your way as you loot, kill and pillage your way across the stunning archipelago. Fill Your Coffers: An extensive economic system allows you to make your fortune in a variety of ways; search for lost treasure, trade goods in local ports, gamble in taverns or head into the jungles for a hunting expedition. Only the Strong Survive: Upgrade your skill tree to learn new attacks and combos and use dozens of historically accurate firearms and blades in tandem with your fearsome hook. Scourge of the Sea: Handpick your crew and set sail. A wide variety of ships can be purchased and upgraded, and different ammunition types allow you to strategically cripple enemy ships for looting, or blast them to the bottom of the ocean. Every Choice Has a Price: The notoriety system allows you to influence the world around you; earn a reputation for pure brutality as you laugh in the faces of those that come after you, or show mercy while manipulating your enemies and turning them against each other.",548,16434.52,-6,2963,52,True,2015
30903,Rake,2015-07-13,4.99,48,Konsordo,Konsordo,"Action,Adventure,Indie,Simulation","Actuality: During the summer of 2003, events in the northeastern United States involving a strange, human-like creature sparked brief local media interest before an apparent blackout was enacted. Little or no information was left intact, as most online and written accounts of the creature were mysteriously destroyed. Witnesses told stories of their encounters with a creature of unknown origin. Emotions ranged from extremely traumatic levels of fright and discomfort. In early 2006, the collaboration had accumulated nearly two dozen documents dating between the 12th century and present day, spanning 4 continents. In almost all cases, the stories were identical... Do ghosts exist? What about Bigfoot, Chupacabras,Rake or Skinwalkers? And how will we ever know? 'RAKE' is the first game in our series of games about paranormal phenomena. You play as Gordon Davis, a scientist, a traveller and an explorer of unknown creatures and unusual events. Having learnt one more legends, Gordon travels through the country in search of poltergeists,Bigfoot, Mothman and other American legends...exploring haunted houses, trekking through creepy bushy forests and scanning the sky and lakes to collect data about the mystical events... So, you are in the place where the strange humanoid - Rake was most frequently seen. Most often he was seen at night. Therefore, you can use the cameras, motion sensors, night vision device for the strange phenomena detection. In the afternoon you are installing equipment in all areas of the forest. You can also mount the cameras on animals, if you manage to lure them into a trap. At nightfall your task is to watch on the monitor for events taking place in the forest. You can switch between the cameras. If you notice something unusual, you can go to a place where the camera has spotted the creature. Do not forget to take a rifle. So you have to hunt down a strange creature, and then kill it or trap it. However, be careful, it can disrupt your plans ... And while watching on the monitor, be aware, it could be closer than you think. The game is over, when you will it... or it kills you... Good luck! Mac OS and Linux versions are in testing. Multiplayer now is in testing. It will be added for free after update the game. Attention!There are some terrible moments in the game. It is not recommended for children 18+ and adults with nervous disorder.",4190,20908.1,1670,3093,0,True,2015
19499,RIDE,2015-03-27,19.99,356,Milestone S.r.l.,Milestone S.r.l.,"Racing,Simulation,Sports","Bikes from the world's most beloved motorcycle manufacturers, breathtaking races, and a round-the-world trip taking in 15 different locations: all this and more in the new videogame: RIDE . Choose from over 100 bikes from the manufacturers that have made motorcycling history, and set off on the World Tour. Challenge rivals at Motorcycle Festivals divided into three different track typologies: from the thrills of the GP Tracks, through the beautiful landscapes of the Country Tracks, and all the way to the challenge of the City Tracks. Race after race, customise and improve your bike in order to work your way up the World Rankings and become the fastest biker in RIDE . As well as the World Tour, players can compete in a variety of different game modes: Quick Race, Time Trial, Split Screen, and online with up to 12 players in the Quick Race and in the Championship. WORLD TOUR: The World Tour is RIDE's main game mode, where you can participate in various Festivals around the world, divided into various categories: Superbike 1000, Supersport 600, Historic Championships, and so on. Each Motorcycle Festival features a variety of race modes: single race, championship, time trial, track day, drag race, and endurance. Each race influences your reputation, and therefore your position in the World Ranking of RIDE players. MULTIPLAYER: Up to 12 players can compete in the online game modes, including quick race and championship; you'll be able to challenge a friend with the split screen feature, and all the results of every race will be recorded on the Leaderboards. BIKES: Choose from a roster of the most beautiful bikes currently in production, and from the models that have made motorcycling history, with bikes from 14 of the world's leading manufacturers. There are more than 100 bikes in RIDE , with displacements ranging from 250 to 1,299 cc, manufactured between 1987 and 2015. Each bike has its own specific mechanical and dynamic characteristics (power, weight distribution, engine architecture, and so on) that have been integrated with a new game physics specifically developed for Ride that allows players, gamepad in hand, to really appreciate the different dynamic behaviour of each model. CUSTOMISATION: RIDE lets you choose from a vast range of gear from the leading specialist clothing manufacturers, allowing you to personalise your rider from top to toe: choose from over 100 items and 400 colour schemes! Your bike is completely customisable, in accordance with two component categories: appearance and performance. Choose from a variety of models of mirrors and wheel rims, or improve performance on the track by mounting a racing exhaust and remapping the ECU. These are just some of the components that you can customize choosing from a catalogue of more than 100 parts. TRACKS: RIDE features 15 different circuits in the various locations where the Motorcycle Festivals of the World Tour take place. Country Tracks: mountain passes, countryside, and natural parks, faithfully reproduced from the real world. City Tracks: circuits winding through the city, with long straights and tight corners that really challenge your riding reflexes. GP Tracks: actual racetracks, chosen to enhance the sensations of riding in the seat of the bike, and being able to push it right to the edge. The renewed Evolving Track System means that the track evolves lap after lap, guaranteeing improved grip along the rubbered-in ideal trajectory as it gets darker and darker as more bikes pass over it. This really helps push you towards a clean riding style, and helps you learn the braking points and the correct trajectories by studying the behaviour of your rivals.",2018,40339.82,1127,3201,54,True,2015
23261,Luminoso,2015-04-17,4.99,0,blizzy Games,blizzy Games,"Casual,Indie","Luminoso is a puzzle game with laser beams. The goal of each puzzle is to make all laser beams hit the receiver pieces of their respective color. Features Many unique piece types, each with different effects. Lasers may have different beam colors. Colors can be mixed to produce new colors, or split into their component colors. 60 hand-crafted levels with varying difficulty. A level editor to create your own levels. Chilling music that doesn't get on your nerves.",5,24.950000000000003,-1,3180,0,True,2015
15883,Super Sky Arena,2015-10-05,14.99,0,Hammer Labs,"Hammer Labs,Deck13","Action,Indie,Early Access","Super Sky Arena is a modern re-imagination of the Starfox multiplayer mode. You pilot a jet fighter to have fast paced dogfights against three of your friends. Play either locally, in splitscreen mode, or create an online game and let your friends join from all over the world. And if your friends are busy, you can always play against the AI to train for future confrontations. We plan to create the ultimate multiplayer experience for this game. To do this we developed (and are developing) many different forms of multiplayer gaming you can enjoy with your friends. Local Multiplayer Online Multiplayer Local or Online against Bots In Development: Couch vs. Couch Multiplayer (Online Splitscreen) Fast paced action dogfight: Fight your friends in a dogfight that requires quick reflexes, strategic maneuvers and powerful weapons Multiplayer in all colors: You can play in local splitscreen mode, join online matches of your friends and eventually combine both in our couch vs. couch multiplayer (this is still being developed) Original music: Each map has its own fast pumping music that reminds us of good old 80s and 90s rock",37,554.63,25,3009,1,True,2015
