index,Name,Release date,Price,Average playtime forever,Developers,Publishers,Genres,About the game,Estimate users,Estimated gross profit,Review score,Total days,Extras trophy,Operating System,year
41058,The Musketeers: Victoria's Quest,2015-08-20,3.99,205,"New Bridge Games,Alawar Entertainment",Buka Entertainment,"Adventure,Casual,Indie,Simulation,Strategy","Guide a young woman on her quest to become a musketeer in this thrilling arcade adventure! The classic tale of the musketeers gets a feminist twist as Victoria sets out to save her king and the country she calls home. As you guide her through 17th Century France, you'll rebuild the charming and picturesque land, perform tasks for the people you meet, and recruit help from fellow adventurers. Along the way, you'll steer a massive sailing ship through a pirate blockade, snatch treasure from the jaws of a dragon, and face a slew of enemy rogues! As you explore caves, castles and more, you'll learn to craft the items you need from the resources you gather. You'll also acquire magic boosters that increase your speed and help you to beat the game's challenging levels. Skilled players can race against the clock to earn a host of trophies, while casual players can enjoy the game at their own pace. With lush visuals, a captivating story, and addictive time management gameplay, The Musketeers: Victoria's Quest offers an unforgettable saga of high adventure! * Vibrant and colorful levels * Over eight hours of captivating gameplay * Make your own tools and other items * Cool boosters that give you an edge * Thrilling mini-games How to play: 1. Collect the resources you need. 2. Clear and repair the path to the exit. 3. Rebuild and upgrade buildings. 4. Complete tasks for NPCs.",47,187.53,19,3055,0,True,2015
38322,Zenohell,2015-10-14,9.99,0,Team Grybanser Fox,Team Grybanser Fox,Action,"Welcome to your Zenohell, soldier. Zenohell is a 90s styled shoot-em'up (in short, shmup) that is all about shooting, dodging, collecting medals and getting score, while blasting your speakers to the sound effects and music. Warning: The game does contain profanities at some points so tread carefully. - 6 stages of ever increasing scale and intensity - but there are more for the especially skilled pilots. - A secret mode that you can unlock. - 3 player ships offering completely different playstyles, with some more you can unlock by playing the game. - A 28 track soundtrack made by Jorgen 'dj_emphatic' Sjolander, that you get for free with the game - just look at the data files. - 3 different gameplay modes. - Music modding, which lets you swap out the music for your personal favorites, if desired. - Options which let you customize your game view, TATE (rotating your screen), Filter, Transparent medals and more! - Gameplay from times when it was more about reflexes and less about complex scoring. We, at Grybanser Fox, are excited to finally show our game to the world and we hope that you will be as excited to play it as we were making it.",83,829.1700000000001,37,3000,23,True,2015
26133,Crypt of the NecroDancer,2015-04-23,14.99,494,Brace Yourself Games,"Brace Yourself Games,Klei Entertainment","Action,Indie,RPG","DELIVER BEATDOWNS TO THE BEAT! Crypt of the NecroDancer is an award winning hardcore roguelike rhythm game. Move on the beat to navigate an ever changing dungeon while battling dancing skeletons, zombies, dragons, and more. Groove to the epic Danny Baranowsky soundtrack, or select songs from your own MP3 collection! FEATURES: Descend into the crypt as 15 playable characters with unique play styles and challenges! Jam out to over 40 original songs in Danny Baranowsky’s award winning soundtrack, or set your own beats with songs from your own MP3 collection! An ensemble of major and minor puns at every half-step! Play with keyboard, controller, or even a USB dance pad! Official Danganronpa character reskins and mod support! BONUS: Includes 6 playable remixes of the entire soundtrack. Remixes by FamilyJules, A_Rival, Chipzel, OCRemix, Girlfriend Records, and Virt! GOLD AND LOOT AWAIT Gather diamonds to unlock permanent upgrades and better equipment to traverse deeper into the NecroDancer’s lair. The deeper you go, the more treacherous enemies you’ll face. RACE TO THE TOP Reach great heights as you disco down through the depths of the crypt. Whether you aim to get the highest scores or complete runs in the fastest times, you can compete against a robust community of players in a range of permanent and daily challenges across all characters. MERCH! Gear up with official Crypt of the NecroDancer items from our merch store !",21848,327501.52,19939,3174,54,True,2015
25996,JamG,2015-07-06,9.99,0,Ernő Király,Ernő Király,"Action,Casual,Indie,Early Access","Control an ever-changing ball along a narrow winding course suspended in midair. Solve your way through challenging levels jam-packed with obstacles, traps and mazes. Morph the marble ball, altering it's size and mass on the spot to more easily get through brain twisting puzzles and platforming challenges.",15,149.85,11,3100,0,True,2015
58789,Teddy Floppy Ear - Kayaking,2015-01-16,4.99,180,Forever Entertainment S. A.,Forever Entertainment S. A.,"Adventure,Casual,Indie","Send your kid onto an unforgettable journey with the world’s most charming bear. Based on a famous Polish cartoon, Teddy Floppy Ear stands out as a great entertainment for children. Prepared by an experienced team, Teddy Floppy Ear – Kayaking mixes fun adventure game with a healthy dose of learning, perfect for young minds. In this episode our main character takes advantage of beautiful, spring weather and goes on a kayaking trip with his friend Piglet. There he finds out that there is a problem with Mr. Catfish who acts a little too bossy, and needs to be taught a lesson in kindness. During his trip, our hero solves numerous puzzles testing child's mathematical skills, eye-hand coordination, logical thinking and perceptiveness. Beautiful hand-painted graphics, soothing music, entertaining and violence free story keep your child occupied for hours. Features: - A dozen of colourful locations - Educational value - Great for even the youngest kids - Absolutely no violence - Numerous mini-games for variety - Soothing music - Famous Teddy Floppy Ear",581,2899.19,308,3271,0,True,2015
36361,Worms World Party Remastered,2015-07-16,2.99,283,Team17 Digital Ltd,Team17 Digital Ltd,"Action,Indie,Strategy","Imagine taking the perfect online gaming experience and one of the most popular Worms games ever made, adding a touch of Steam achievements, leaderboards, cloud saves, full controller support; a little sprinkle of 1080p / 60FPS, all rounded off with enhanced weapon sounds effects and an improved frontend. And you have Worms World Party Remastered. With both single player and up to 6 players leading their worms into manic multiplayer mayhem, this unique, wacky, outrageous, addictive and deadly (to Worms anyway) combat game is remastered and ready for action. FEATURES: Access the fantastic 'Wormpot' which gives you over 1000 different game styles. All modes are available offline, online, or a mixture of both! Over 20 Multiplayer missions: players can now team up with a buddy to tackle cooperative missions where working together is the only way to twin. Alternatively, check out the competitive missions and fight in specially prepared scenarios. Single player and multiplayer, 2-6 players either local or online. It’s a veritable feast with nearly 60 weapons, ranging from the relatively calorie-free bazooka to the full fat concrete Donkey. Oh man! If you’re late to the party scene, don’t worry. Our friendly training section will soon have you dancing with the rest of us. Shiny 1080p graphics with 60 fps Enhanced weapon sound effects Cloud Saves Full Controller Support Steam Leaderboards Steam Achievements MODES: Quickstart Game - get to play quickly with predefined team and weapon set against AI (Wormbots). Training - host different disciplines in which to train. You work against the clock. Missions - ranged between easy and hard. Custom terrains for won missions unlock for normal games. Time Attack - Missions but with different ways to complete them. The player must figure out which one is the fastest. Deathmatch challenge – similar to normal games. Player take on a number of computer teams in an ever-increasing spiral of difficulty. Rewards given to high ranked teams.",1372,4102.280000000001,20,3090,15,True,2015
8018,Notch - The Innocent LunA: Eclipsed SinnerS,2015-06-04,9.99,370,"Angels Blue Digital Entertainment,DigitalEZ",DigitalEZ,"Adventure,Casual,Indie","Are my memories reality, or just a dream? This is an isolated town, a town of memories that have been forgotten by the people. However, this small town has not been quiet and peaceful since the murders began. Old memories have been awoken by the tragedy that began this summer, People are being forced to face the difference between illusion and reality. These people sometimes escape their daily lives in dreams of the ruin and rebirth, Only to awaken from dreams to their beloved is gone forever. Alpha Episode No matter what the world changes into... No matter what our lives become of... I am by your side, and rise to the bloodbath. Time passes by, Where are the sinful spirits going? Whose life are they calling for? Omega Episode What is goodness? What is evil? What is love? What is hatred? You, have already become a shadow in my dream upon the uncovered reality. After suffering while searching for you, I understand how important you are to me. If I could hold your hand again, I would never let you go despite anything that happens. My dream is as real as a deep decayed abyss. The flower blossomed by evil is called redemption. Game Features Play through 10+ hours of story with multiple branching routes and 14 unique endings. Over 50 songs created by the most talented composers and musical organizations. A vibrant world brought to life by the artwork of talented artists.",691,6903.09,453,3132,23,True,2015
22648,Lost Lands: A Hidden Object Adventure,2015-09-24,0.0,115,FIVE-BN GAMES,FIVE-BN GAMES,"Adventure,Casual,Free to Play","Persecuted by ill fate, the elven nation land on a lost island. They'll need sharp blades as well as sharp minds to survive. An exciting hidden-object adventure game which tells the story of an ancient elven tribe forced to survive on a long-lost island. Lost Lands: A Hidden Object Adventure is a free to play game from the creators of the Lost Lands and New York Mysteries series. The elf place is destroyed. With their kingdom in ruins the elves were forced to set off overseas to search for a new home. By fate's will, a storm crushed their ships on the shores of a lost island. High mountains, fragrant valleys and shimmering rivers - what else might the children of nature need? But their beautiful new world is filled with danger. When attempting to leave, the elves learn that the island is surrounded by an impenetrable magic storm. The survivors recall a legend about the last of the ancient elves, who shall awake from a thousand year's sleep to help them overcome hardship. Help the elf people survive on a lost island! Complete quests and puzzles to advance an exciting story! Examine locations and learn more about the Lost Lands! Defeat dangerous opponents! Wield your mind as a weapon! You're about to see: • More than 200 interesting quests • Lots of hidden object scenes • Various puzzles and mini-games • Many collection and achievements • Dangerous creatures and fairy tale characters • Regular free updates!",5100,0.0,3945,3020,48,True,2015
27487,Leadwerks Game Launcher,2015-08-24,0.0,9,Leadwerks Software,Leadwerks Software,"Animation & Modeling,Design & Illustration,Education,Software Training,Utilities,Early Access","Leadwerks Game Launcher lets you play a variety of creative, experimental, and just plain wacky mini-games made with Leadwerks Game Engine . Fly a spaceship through an asteroid field, play a round of miniature golf, or ride a lawn mower while dodging killer cows. It's free and there's a constant supply of new things to try. With Steam Workshop integration, you can talk directly to the developers and give your feedback for new ideas to be incorporated into their games. Start a discussion and let the devs know what you liked about their game, what can be improved, and any new ideas you have to add to their game. Your feedback will help them design their game and create something new and unique for the Steam community to enjoy. If you're looking for the latest polished blockbuster AAA game with no rough edges...this isn't it. If you want to try something off the beaten path, complete with glitches, experimental ideas, unbeatable levels, and a never-ending variety of new things to do, get Leadwerks Game Launcher. It's free and includes more than 25 mini-games, with new ones being added all the time. Here are some of the mini-games you can play right now for free: Hunt for Food Asteroids3D Vectronic Mini Golf Beach Roll The Mower Cuber Evaluation Abridged Castle Defender The Hankinator's Funhouse The Hankinator's Phantasmagoria Slafstraf Horror Cuber Nuke Tunnels of Tarkus Rise of the Pumpkinheads The Biodome One More Day Lockdown",46,0.0,20,3051,0,True,2015
30422,Anna's Quest,2015-07-02,1.99,215,Daedalic Entertainment,Daedalic Entertainment,"Adventure,Indie","Dragons, witches, trolls... No one can stop Anna. With her telekinesis, unorthodox use of torture instruments, a knack for improvisation and the help of a shady fox she just makes her way. She communes with the dead, shuts off the local taverns beer supply and gets old ladies behind bars... The world of author Dane Krams' debut on the game development stage isn't as cuddly as it may seem. Anna however, is actually perfectly nice - or is she? It all starts with freeing talking teddy bear... Anna's Quest unfolds a hand-drawn, grim tale with a good dash of self-irony. Unlimited inventory with special slot for a baby dragon Small-time Vandalism Discover a Unicorn's inner beauty Black magic and telekinesis - this time, not exclusive to villains! Executions for the whole family! light-hearted, courageous, bad-ass: Anna Classic Point &amp; Click controls with hotspot-indicator Awesome ending (really!)",1890,3761.1,1432,3104,39,True,2015
45594,Streets of Chaos,2015-01-28,0.0,217,SimProse Studios,SimProse Studios,"Indie,Simulation,Strategy","The Conspiracy DLC now included with the main game! New features added below, feel free to check it out! The year -- sometime in the future. The world as we knew it has crumbled and descended into chaos. Crime of all types is rampant and committed openly. Police and other vital services are stretched to the limit. Your time is now. Loosely inspired by the classic strategy PC game Chaos Overlords, Streets of Chaos is a unique strategy/board game hybrid where you become the leader of a rising resistance in a world gripped by crime and anarchy. Your very simple goal: to take over the city and run it -- your way. Your obstacles: the police, the judges and one other rebel leader who, like you, sees this broken city as his for the taking. Features: - Recruit randomly generated members of your posse with 7 different stats forming their skills, equip them with weapons and armor and send them on missions of various types. You decide how to allocate their attention. Take over a street, hack a database for some cash or resources, or search for that rogue rebel leader and take him out. - Choose from dozens of game challenge combos for long term playability. - Hire lawyers to defend you, bribe (or assassinate, if they get in your way) judges. Use the system to your advantage. - A totally randomly generated world to play in every game. No two games are EVER the same! Equipment, characters, city layout, it's all different every time you play. - Includes full original music, an attractive and intuitive interface and tons of strategic angles and paths to victory. Deal with vicious HQ attacks, make side deals with rival gang members, exchange resources for game benefits, deal with random events changing the rules, and more! - Designed to play: Help popups are on every screen and mouse over tool tips are liberally scattered through the game to make getting into playing quick and easy, along with a quick tutorial. - High-res profile portraits included. - Buy randomly generated items at the Pawn Shop to equip your crew with that boost their abilities. Stake your claim today on these Streets of Chaos!",89,0.0,-27,3259,0,True,2015
58683,Cultures - Northland,2015-03-26,0.54,138,Funatics Software,Daedalic Entertainment,Strategy,"The Vikings are back! Loki, known from the Nordic sagas as a versatile god of lies and weaver of many intrigues against his divine 'colleagues', has been banned from Asgard by Odin as a punishment for the trouble caused by the Midgard serpent. Now Loki is plotting revenge and searching for a possibility to sneak back into Asgard and pay Odin back. Out of spite, he abuses our four human heroes--Sigurd, the Frank, Hatschi, the brave Saracen, Bjami, and Crya--with his intrigues and traps. Embark on adventures and quests to help your allies wrest free from Loki's insidious machinations, whether it's a plague of serpents or the demon wolf Fenris dropping by for a rather unexpected visit. Ensure the health and safety of your people as you start with but a humble town and work your way up to a large city. Cultures - Northland offers the best combination of strategy and adventure! Three difficulty levels that make the game fun for anyone Explore unknown territories and establish trade routes with other tribes Watch as your inexperienced fighters grow into fearless heroes of great renown Solve challenging quests and adventures",496,267.84000000000003,313,3202,0,True,2015
54406,Ironkraft - Road to Hell,2015-10-22,9.99,0,Invoker Studios,Invoker Studios,"Action,Casual,Indie,Early Access","Ironkraft - Road to Hell is a fast paced 2.5D side-scrolling car-brawler with an alternative World War II story - Zombies, Nazis, Customized Cars and maximum craziness included! Oh, did we mention Aliens too? In a Mad Max-like post-apocalyptic vehicle driven universe, where people are living in isolated colonies on Earth, no one can be safe on the road. The scarce supplies of the remaining cities are transported by the so-called Roadtraders. You! And remember: Drive-Crash-Shoot-REPEAT! Ironkraft - Road to Hell rolls out with: Physics-based Destruction Great 2.5D Graphics Secret Places Crazy Story Easter-egg Parade Crazy Weapons Loot! Loot! Loot! Car-crafting System Trading System RPG Elements",8,79.92,-4,2992,11,True,2015
5011,Redemption: Eternal Quest,2015-08-28,0.99,231,SimProse Studios,Trinity Project,"Casual,Indie,RPG,Strategy","Redemption: Eternal Quest is a casual-themed RPG/Sim game which combines the feel of an RPG with roster management sim mechanics. You become the leader of a band of adventurers, guiding them through quests and adventures, healing them, watching them grow (or not!) and signing them to new pacts while keeping your gold pouch filled. Features: -- Take leadership over 6 adventurers that you choose, each with different strengths and weaknesses, bonuses - and hidden mysteries. -- Completely re-playable – play with certain time or quest limits, or play unlimited seasons in a campaign. Everything is randomly generated every game, for maximum replayability. -- Full variable aging and injury/disease engine built in for maximum challenge. Gain experience levels, and increase in ability over the seasons. Variable development curve - some will develop into fearsome warriors, some won't. -- Characters form relationships with each other over time, good or bad. Sign them to contracts (or 'pacts') to keep them happy and working for you, or if they’re too greedy, decide when enough is enough and cut them loose. Pacts can include up-front money, yearly money or a percentage of treasure found. -- Choose your path: Train your warriors in school and build them up, or draft seasoned hirelings later on to take their place if they don’t cut it. -- You set the pace: You can send them on easy missions into realms with limited danger (and maybe limited rewards) but protect your warriors, or send them into more dangerous worlds for more rewards. -- Music, detailed graphics and polished UI to draw you into the world. -- Engage in unique card-based combat with over 200 different monsters, each with different fighting strength ranges. -- Explore ruins, dungeons and open treasure chests, and complete unique grand quests. Choose your destiny with Redemption today!",111,109.89,-8,3047,0,True,2015
21688,Cosmophony,2015-07-09,4.99,120,Bento-Studio,Frogames,"Action,Indie","Cosmophony is a musical shooter designed for demanding gamers seeking an original and intense experience. You must control the heart of a fallen goddess within a dying universe in order to fulfill her destiny. Your goal is to progress through a series of levels designed to be played to an exhilarating, 100% drum and bass soundtrack by DJ Salaryman (DnB Arena, RAM records). Discover a powerful new gaming experience that is uniquely satisfying. - Constant 60 FPS - Unique synesthetic design based on music - Impressive HD graphics with psychedelic background videos - 100% DnB soundtrack created especially for the game Note that this game is designed with more experienced gamers in mind: the difficulty level, while gradual, is still very high.",100,499.0,70,3097,6,True,2015
21567,Karos Returns,2015-07-30,0.0,5,Galaxy Gate,RedFox Games,"Free to Play,Massively Multiplayer,RPG","Game Summary: After a tenuous peace between the four races of Broccion, the world is at war again, seeking leadership. Players take up arms for their guild and for their nation to battle for land, resources, and victory. Choose from four races (Human, Shadow, Seroine, and Vaneese Human) and seven classes (Mystic, Bow Mistress, Blader, Paladin, Rogue, Sorceress, and Gunner), then gain experience to grow into an advanced class, and Fletta to improve your abilities. Unique Features: - Fletta System that allows unique class customization - Explore the dozens of cities and territories in Asmara - Guild Warfare: None-siege Type Battle Modes Castle Siege, Mine Takeover, and more - Crafting System: Forge powerful armor sets through hunting, fishing, and mining - Arena System with unlimited Arena Matches Game Outline: Players fight their way through quests, guild clashes, large-scale PvP action and castle sieges to bring peace to the fantasy world of Asmara. Players can choose from four races (Human, Vaneese Human, Seroine and Shadow) and seven classes (Bow, Mystic, Mistress, Paladin, Blader, Rogue, Gunner, and Sorceress). In addition to the traditional experience-point-based leveling system, Karos Returns features the Fletta system that can be used to increase stats, give buffs, buy resources and enchant items. Furthermore, open world PvP adds a morality system to the game, providing an even deeper level of customization for online gamers.",494,0.0,226,3076,0,True,2015
41054,Space - The Return Of The Pixxelfrazzer,2015-11-02,2.99,9,Sørb,Sørb,"Action,Casual,Indie,RPG","Space - The Return Of The Pixxelfrazzer is an open-world sci-fi hack'n'slash. Your aim is to explore the inexhaustible amounts of destructible asteroid fields, spacestations and unknown planets of the universe. And by exploring I mean hacking, slashing and destroying everything that comes into your way. Shredding all kind of objects means getting more resources and getting more resources means upgrading your ship so you can shred more kind of objects, which rapidly becomes an addicting spiral. And maybe, one day you'll probably find out about one of the most unsolved mystery of our universe... the pixxelfrazzer. Be excited of all the cool features this game brings to you: • all sorts of combinable weapon upgrades and active abilities • procedurely generated infinite world • quests • cool physics • randomly generated music • local co-op (Xbox360 controller required) • and a lot of love Not only is Space completly designed, created and programmed by one person, the whole gameengine is build up by this guy and this grants you an unique experience of a game the couldn't be any more indie.",33,98.67,31,2981,0,True,2015
