index,Name,Release date,Price,Average playtime forever,Developers,Publishers,Genres,About the game,Estimate users,Estimated gross profit,Review score,Total days,Extras trophy,Operating System,year
58011,Switch Galaxy Ultra,2015-11-20,9.99,271,Atomicom Limited,Green Man Gaming Publishing,"Action,Indie,Racing","Switch Galaxy Ultra is an insanely addictive, fast-paced arcade challenge. Weave your way past obstacles and enemies as you travel across the galaxy collecting Tantalum for Dakur Technology. It’s loaded with content and features that will have you blazing across the galaxy at breakneck speeds. Earn credits to spend on new ships and upgrades, hit speed-ups and collect power-ups to get record times. If that’s not enough try out the survival mode with one life and infinity in front of you, how long can you last? • Truly exhilarating high-speed gameplay • 6 stunning vehicles, fully upgradable • 55 challenging levels • Episodic Comic designed by original WipeOut concept artist Darren Douglas • Cities designed by WipeOut co-creator Jim Bowers",92,919.08,-19,2963,14,True,2015
35392,CHAOS - In the Darkness,2015-10-07,7.99,0,4Realms,4Realms,"Action,Adventure,Indie,RPG","'From snow capped peaks of Njördiack to the wide, stretched lands of Ha-Dys, this country once full of promise was now in the grip of Chaos. Released from Deepholm by the felon god Methem, Chaos has spread to the world as a disease, devouring the souls of the peoples of the Silmerie. In a final burst of courage, the armies of five kingdoms joined forces and swooped down on the ruins of Branilv at the heart of the region Ymar. This was where the world of Men had cracked, releasing Chaos from its jail of darkness. But brave warriors fought a too powerful enemy, indifferent to steel and fire. When the last of them finally died, the king Meldorian realized that the world was entering so dark times that the light itself will be forgotten. Secluded in the white stone fortress which overlook Rhianon, the proud city of Silme, he contemplated his kingdom one last time before that Chaos spreads its shadow on. But although humanity seemed to prepare for death, the gods offered men a last present: the weapons to fight. In a few days, the same stories began to travel throughout the Silmerie. Thus, it was told that a disciple of Brohmar became in flames while praying and hadn't suffered any burns, or that a Paladin of Nerhacte had fully healed a dying person. In Agrimaar, a disciple of Aelien seemed able to completely disappear into the shadows while in Ha-Dys, a scribe of Stabia could freeze time within a few seconds! It was even said that a woman had resurrected her husband by praying Yshante. The gods had offered to men some powers and extraordinary abilities, but for what purpose ? To stand in the way of Chaos... and perhaps win ? The story will tell. Your story.'",30,239.7,-10,3007,0,True,2015
53432,Toto Temple Deluxe,2015-09-29,9.99,0,Juicy Beast,Juicy Beast,"Action,Casual,Indie","'Toto Temple Deluxe is near perfect and delivers an amazing party experience' - Rares Gruian (8WorldsNews) 'It's simple and addictive - what a multiplayer game should be.' - Mysterious Indiecade Judge 'It's fun, it's crazy, and you'll undoubtedly be yelling.' - Alpha (N4G) 'It is stupidly fun. You'll likely find yourself standing in front of the screen, yelling at your fellow goat stealers and jostling them in real life.' - Dan Tynan (Yahoo) Toto Temple Deluxe is a fast-paced, local-multiplayer king-of-the-hill style game in which players must steal an egg-laying goat from their friends and try to keep it on their own head for as long as possible. You know, normal stuff. Dashing Gameplay Infinitely dash in any direction to swiftly move around and powerfully headbutt the goat carrier to steal its four-legged booty. Escape your jealous opponents and protect the goat by blocking their attacks with a well-timed shield pop! You’ll 'get their goat', guaranteed. Classic Mode Prove you’re the ultimate shepherd in Classic mode: Gather 3k points first by holding on to the goat, collecting coins hatched from goat eggs (yeah… don’t ask) and harnessing the power of powerful power-ups! Play as teams or in free-for-all. Bomb Mode Blast everyone’s face off in Bomb mode: Be the first to grab the explosive goat (we know, stop interrupting us) and keep it long enough for it to detonate near your soon-to-be-dead rivals. Lose the goat and the timer resets! Play as teams or in free-for-all. Temples Each temple offers a unique, exploitable mechanic for you to discover. Use them wisely and outsmart your opponents like they don’t even... what?… how did you..? Bots Bots will play with you whenever you want and for as long as you want. They never complain. They also never open up your fridge and ask if they can eat that pizza slice you got left from last night. Bots are awesome. Oh, and you can change their difficulty level too, because they will probably kick your ass-tonishing little bottom.",51,509.49,37,3015,10,True,2015
1644,Port of Call,2015-08-28,0.0,70,Underdog Games,Underdog Games,"Adventure,Indie","Imagine waking up on a small dock with no recollection of who you are or how you got there. The first person you find is a grumpy, old man who enlists you to work on his ferry boat which seems to have materialized behind you. But not all is as it seems on this strange ship, and the people you meet may know more about your past than they let on. Port of Call is a narrative exploration game that focuses on telling the player an immersive story. The game is an experiment in short-form storytelling in an immersive media. Interact with the ship's passengers and explore your surroundings in first person to try to uncover the secret of your past.",1158,0.0,907,3047,7,True,2015
2330,Warlocks vs Shadows,2015-08-19,13.99,381,Frozen District,ONE MORE LEVEL,"Action,Indie,RPG","Warlocks vs Shadows is an action RPG/brawler game set in a fantasy world invaded by shadow monsters. Playing as an incredibly powerful Warlock and, by using magic skills and weapons, you fight through hordes of enemies. The game places great focus on co-op and versus play between players, where you can fight in 1-4 player DeathMatch or in teams of 1v1 or 2v2. In the singleplayer/co-op campaign you have to clear your way through 5 different dimensions with unique enemies, bosses, and environments. You level up your character by slaying evil monsters and getting better and better items. Pixel art graphics 1-4 players (co-op, versus) Online co-op and versus mode Procedurally generated loot 5 different worlds to explore 11 playable characters with different gameplay Cross-platform multiplayer (Linux, Mac, Windows)",285,3987.15,59,3056,21,True,2015
54447,The Last Crown: Midnight Horror,2015-10-29,4.99,1,Darkling Room,Iceberg Interactive,"Adventure,Indie","Halloween: the veil between our world and the 'otherside' is at its weakest. Witches celebrate Samhain, a Celtic festival from the old religion, conjuring the dead and communing with the spirits. Nigel Danvers, ghost-hunter, knows all about the ghosts that dwell in the darkness, he has seen plenty to convince him there are dark forces at work. So, why is Halloween so different? Dusting down his old ghost-hunting gadgets, Nigel gets to work. Something is haunting the guest rooms above the local harbour side pub, The Bear. Who or what hides in the shadowy corners of the old Inn? What is the presence at the end of the Harbour Wall? Nigel has one night to find out, before the veil returns to full strength, and the Halloween Horror is gone, for another year. A classic point and click adventure. An intermezzo between The Lost Crown and The Last Crown: Blackenrock. A story driven plot by Jonathan Boakes (Dark Fall, The Lost Crown). Test your detective skills to uncover a paranormal mystery. Utilise an array of ghost-hunting gadgets to see and hear the spirit world. Interact with the Saxton locals, in your pursuit of the truth. Dabble in the Dark Arts, on Samhain, like the witches of old. Collect ghostly evidence, to scrutinise for clues. Play several Halloween Party games, many with a supernatural twist. Practise your Psychometry skills, with local white wicca, Nanny Noah. Full cast audio and music, plus atmospheric sound effects. Play Trick and Treat, at your peril! The Last Crown : Midnight Horror is playable in 2 formats - • 1280 x 960 (HD+ 4:3 ratio, for regular screen displays) • 1280 x 720 (Widescreen 16:9 ratio, for wide displays and laptops) Both formats have Windowed mode or full screen, changed via Settings. Save games are not compatible between formats.",123,613.77,69,2985,0,True,2015
25643,The Secret of Tremendous Corporation,2015-10-12,0.0,14,"Sebastian Krzyszkowiak,Konrad Burandt,Paweł Radej",dosowisko.net,"Adventure,Casual,Free to Play,Indie","A game about games, secrets and stuff. In the near future, thanks to copyright and patent law abuse, all of the gaming industry became controlled by one corporation, producing low quality but highly profitable casual freemium games and ceasing development of any other more ambitious genres. Any game development outside of the company became outlawed, ending the era of indie games. Assist young Max Burton, a mighty gamedev wannabe and enthusiastic fresh intern on his first day at his first job in the only gamedev company out there in this short, (soon to be) award-winning free point-and-click adventure game . Explore the deepest SECRETs™ of the Tremendous Corporation®. Find out what happened to indie devs and save the gaming industry! The Secret of Tremendous Corporation contains revolutionary gaming features that revolutionize your gaming experience: clicking on stuff walking around waiting for your character to move to the other edge of the screen dialogue skipping boring dialogue playing in a window playing fullscreen ...and many more! Now on GNU/Linux and Windows, macOS coming soon™. The first version of this game has been made during Global Game Jam 2015 in Poznań, Poland under the name 'The Game Jam Game About Games, Secrets and Stuff'.",331,0.0,209,3002,3,True,2015
7615,Purgatory: War of the Damned,2015-02-11,14.99,0,Ironsun Studios,KISS ltd,"Action,RPG,Early Access","Purgatory is a fast-paced multiplayer fps game where you use a multitude of spells with a variety of effects to destroy your enemies. Participate in duels, team battles or free-for-all in the mysterious realm of purgatory, where all arenas have a history which chains them to this world. Key features • Destroy your enemies with multiple spells, items and abilities • Fill up your load-out with purchased spells or random spells spawned during matches • Increase the power of your avatar with magic affinity and items • Multiple maps for multiplayer mayhem in various match types • Day/night cycle in appropriate maps • Diverse fantasy environments Players take on the role of souls cast into purgatory, where they will wage eternal battle to absorb the souls of the fallen, thus increasing their power and dominance. Spells are categorized into 'Schools' of magic; Arcane, Elemental, Light and Dark. Increase your affinity in the various magic schools by using their respective spells, gain experience to wield greater power, earn soul fragments and exchange them for greater spells, items and abilities.",20,299.8,-8,3245,0,True,2015
54151,Mirrored - Chapter 1,2015-10-30,0.99,0,"Kelkafa Studios,Cardboard Sword Limited,Jet Stone Studios",Kelkafa Studios,"Adventure,Indie","3D Point-and-click adventure puzzle game wrapped in cinematic 2D cut-scenes. After a concerning message left on Rob's answer-phone from his panicked-sounding twin, Nick, he rushes to his brother's office to try and find a hidden mask. Not long into the search, things take a very dangerous turn... Who is the dead man in the newspaper article? What is so important about this mask? And where is his brother? Mirrored - Chapter 1 is the first part in this escape-the-room style trilogy.",112,110.88,30,2984,6,True,2015
42657,Vortex Attack: ボルテックスアタック,2015-05-27,7.99,211,KaleidoGames,KaleidoGames,"Action,Casual,Indie","From an initial choice of ships, (more unlockable by playing) the player has to destroy all the vortices they will face across the galaxies. Features Up to 3 simultaneous local players 11 ship models (upgradeable up to 4 levels each) STEAM: Online leaderboards and over 70 achievements Regular tournaments (via Steam or Fairs) Sci-fi particles madness Tons of individual upgrades Hundreds of fun levels featuring the innovative Vortex System, bosses and bonus Multiplayer designed gameplay Action neo-retro FX and music Arcade coin-op: Design and integration Real machine hosted in 'Arcade Vintage' (Petrer, Spain) built just for our game. Ships Basic Ship Vektar - LOTS OF HEALTH - BASIC SHIP FOR NOVICES Ships: Tier 1 Voxar, Rozer, Blaster - FAST SHIP - GOOD MULTISHOT - MANY ADD-ONS - AVERAGE SHIP - STRONG SHIP - POWERFUL BULLETS - FEW ADD-ONS Ships: Tier 2 Valkyr, Metr-81, Kromaia, Blaxar - FAST SHIP - FEW BUT POWERFUL SHOOTING - GOOD ADD-ONS - FAST SHIP - AVERAGE FIREPOWER - POWERFUL ADD-ON - FAST SHIP - POWERFUL ADD-ON - FASTER GAMEPLAY - HEAVY ARTILLERY - VERY POWERFUL BULLETS - ALMOST NO ADD-ONS Ships: Tier 3 Verminest, Beekyr - HARD &amp; SLOW SHIP - FEW BUT POWERFUL SHOOTING - MOST ADD-ONS - WEAK &amp; FAST SHIP - HEAVY MULTISHOT Game mechanics The goal of each level is to destroy the vortices. Although some vortices will take several stage to destroy. Upon reaching a level where the vortex can be totally destroyed, it will unleash the most dangerous of its swarms to make things a lot harder for our players. The twist we've added in this game is that the vortex on each level will keep growing, throwing ever increasing waves of enemies to overwhelm the player, so that they must continually fight to push the vortex back. The game has been especially designed to play with up to 3 friends, although we're considering adding an optional fourth player based on player feedback. To implode the vortices, the player must destroy enemies to collect their energy. On top of the vortex there are two spheres: The player level (blue sphere) and the vortex level (red sphere). When the energy item sent by the player reaches the vortex, the blue sphere shrinks the black hole, symbolized with the red sphere. But in the other hand the black hole is constantly growing stretching the blue sphere. The game ends when the blue sphere makes the red one disappear or the red one grows to its maximum size. The concept is kind of new, reuses the concept based in Beekyr and improves it by removing the unnecessary bits. Game's history The alien war machines caught us by surprise. A strange energy vortex appeared near colony Vehar-12, then they came, swarming from the centre of the vortex. The first attack was just over 20 Eartho-days ago and already eighteen colonies have been lost. 56 million souls, gone. Now they're approaching Earthos, our biggest colony. We're fighting back, but if it falls, we will be all but destroyed. The vortices had seemed all but indestructible. But now we have hope. Our technicians patched together a captured war machine, and discovered the key to the vortices, a new kind of energy they've dubbed 'Lumergy'. Our first tests of the device lead to an unexpected discovery. The energy used to create a vortex could also be used to destroy one. Using our modified war machine we can collect the Lumergy, and reverse its energy to collapse a vortex, destroying the swarm within. We can predict where the next vortex will open, and we can destroy it. We have only one chance at this, only one ship. Your only mission: Destroy the vortices. Save all of us.",93,743.07,63,3140,76,True,2015
55926,Verdun,2015-04-28,19.99,756,"M2H,Blackmill Games",M2H,"Action,Indie,Massively Multiplayer,Simulation,Strategy","The game takes place on the Western Front between 1914 and 1918, in one of the bloodiest conflicts in world history - inspired by the infamous Battle of Verdun in 1916. Verdun is the first multiplayer FPS set in a realistic World War One setting, the game which started the WW1 Game series. The vicious close quarters nature of trench warfare means that skill with a bayonet can be as vital as good aim with a rifle. The game offers 4 distinct game-modes with many historically accurate features such as realistic WW1 weaponry, authentic uniforms, horrendous gore, and maps based on the real battlefields of France and Belgium. The dynamic Frontlines game mode features 64 players taking turns to go over the top and attempt to capture the opposing trench line. Verdun key features include: Experience World War One gameplay: Accurate weaponry with realistic bullet physics, skill based weapon handling, poisonous gas with a claustrophobic gas mask experience, horrendous gore effects, and ferocious artillery barrages Tactical squad-based FPS: 15 distinctive squad types representing soldiers from 5+ countries, each with distinct weapons and equipment True trench warfare: Real-time dynamic frontline with momentum based attack and counter-attack gameplay Authentic World War 1 setting: Typical WW1 music and style, historical battlefields representing the most active parts of the Western Front Challenging game modes: team-based Frontlines, tactical Attrition, skill-based Rifle Deathmatch, and relentless Squad Defense WW1 on the Western Front The gameplay in this true WW1 battlefield experience is as immersive and gritty as it can get, with features such as optional realistic gore which portrays the true horror of the First World War and authentic weaponry including artillery and gas. Weapons need to be handled with skill - each gun handles differently and there are no floating crosshairs to aid your aim, along with realistic bullet physics to contend with. Battle your way across no man’s land to capture the next enemy trench line, before switching to defense to protect your gains in the Frontlines game mode. Keep your head down or quickly don your mask in the event of artillery strikes or gas attacks. This unforgiving war isn’t for the faint hearted! Authentic World War One Setting The WW1 Game Series currently includes Verdun, Tannenberg (set on the Eastern Front), and the upcoming Isonzo, which is set on the Italian Front. These authentic WW1 shooters let players choose from a range of squads from across the war, as they fight for control of the ever-changing frontlines. For Verdun, we carried out extensive field research at the battlefield itself and were advised by knowledgeable historians to make sure the individual elements in Verdun are as historically accurate as it can get. Uniforms have been recreated to the tiniest detail, the weapons are modeled to exact references and the maps use realistic props and terrain layouts. Everything in the game has been tailored to recreate the grim atmosphere so typical of WW1, from the immersive interface and war torn maps to realistic sounds and voices that evoke the feeling of actually being there in the mud covered trenches, peering out over no man's land in search of the enemy. Or if you want to chat with us...",36069,721019.3099999999,25655,3169,60,True,2015
46035,Age of Fear: The Undead King,2015-06-26,4.99,488,Leslaw Sliwko,Age of Fear,"Indie,RPG,Strategy","Play as either Sir Edward, a noble Knight defending the Human Kingdom, or Krill, a wicked Necromancer with an unearthly lust for power. Whether you choose to protect the King's lands or work to destroy them, an adventure of epic proportions awaits! AGE OF FEAR is a long-running series of fantasy turn-based strategy games loved by fans for its tabletop wargame battle system and in-depth RPG customization. Age of Fear: The Undead King is the first foray into the series' deeply tactical gameplay with two campaigns to choose from. (scroll down for a list of features and selected mods) FEATURE LIST ⭐ HEX-FREE BATTLES - test your tactics with a novel movement system where size matters and units aren't constrained by artificial grids! ⭐ ALIGNMENTS such as Evil and Holy. Units from opposite sides won’t like each other and may desert. A bit of diplomacy (or charisma!) is needed to manage such relationships. ⭐ EXTENDED STORY including many sub-quests, optional events, alternative endings, more detailed lore, etc. ⭐ FREQUENTLY UPDATED - we take our work seriously and patch our games often with new features and content. Also, whenever possible, those updates are back-ported to all our previous games! ⭐ COMMUNITY-DRIVEN - we listen to our players and continuously improve! Go and check our forums, everyone has their say and we implement those suggestions. ⭐ FULL OF JOKES - who said strategy games have to be serious? All the best fantasy jokes have a home here! ⭐ PARTY CUSTOMIZATION - build and upgrade a custom army from more than two hundred unique units, skills and spells (but be aware of racial animosities!). ⭐ DEEP BATTLE MECHANICS - learn the basics in a hurry, then develop new strategies around a huge variety skills, spells and battle hazards like neutral factions and environmental effects (yes, you can anger bystanders!). ⭐ EASY TO MOD - create your own missions, or even full-fledged campaigns, to be shared with the Steam community! ⭐ FANTASY STORYTELLING - get wrapped up in two separate storylines featuring a motley crew of characters, globetrotting adventures and fantasy shenanigans galore. All hand-illustrated! ⭐ PERMANENT DEATH - accept the grim realities of death where all units that fall in battle stay dead... unless an evil Necromancer raises them as Zombies. ⭐ ARTEFACTS AND RELICS - discover numerous unique weapons, armours, potions and treasures, with the rarest granting powerful OP skills and stat bonuses. ⭐ ADVANCED AI - our AI is built upon a self-organizing network of agents and meta-heuristics algorithms (yes, we are PhD-smart!). Discover one of the most sophisticated AI systems you've ever played against! ⭐ LOW HARDWARE REQUIREMENTS - run the game even on that old potato laptop of yours. Your stone-age computer is good enough! ⭐ COLOR-BLIND MODE - a special mode with higher contrast and outlined fonts. ⭐ ...everything else we come up with! Purchase only if you want access to the latest features in the Age of Fear series, and please keep in mind that this is an evolving product. If you're hungry for a no-nonsense, old school turn-based strategy game, you've met your match in the Age of Fear series. Enter the fantasy world of Age of Fear today! SELECTED MODS",350,1746.5,273,3110,21,True,2015
2328,Dustbowl,2015-05-18,8.99,0,The Pompous Pixel,The Pompous Pixel,"Adventure,Indie,RPG","You are just another face trying to survive the aftermath of a terrible event which shook the world. With your father you have made the Hub your home, an underground shelter that protects what's left of civilization from the horrors that roam the ruins above. Soon you will be tested, soon you will have to leave your home and enter the wastes! Key Features Random encounters, from combat, points of interest, wandering NPCs and Easter Eggs. Follow quests that push you deeper into the unknown with colorful dialogue for every character. A simple crafting system, turn your junk into life saving tools. A massive world with over 50 locations to explore and loot. Survive Get hungry, get thirsty, get sick, stay alive relying on your wits and skill! A huge main quest line that takes the player across the blistering wastelands. Each NPC has a unique, detailed character portrait bringing the world around you to life.",120,1078.8,65,3149,46,True,2015
44445,ClusterPuck 99,2015-01-23,4.99,1,PHL Collective,PHL Collective,"Indie,Sports","ClusterPuck 99 is a sporty competitive sports game about sports based on athletics! Local multiplayer madness! ClusterPuck 99 is an 8 player game built for parties and smack talk. Bash your friends to gain control of the puck and then fight your way through to your opponents goal. Try to score while avoiding spikes and utilizing speed boosts to blast past other players. Compete in intense 8 Player Local Co-op matches! Support for Xbox 360, Xbox One and Playstation 4 controllers. Navigate through 20+ dangerous maps littered with spikes, bumpers and speed boosts. Single Player Challenge mode! Customizable team colors and players. Instant replays, stat tracking and more!",115,573.85,62,3264,18,True,2015
42506,Hacker Evolution Source Code,2015-05-11,9.99,0,exosyphen studios,exosyphen studios,Indie,Ever wanted to see how the popular Hacker Evolution games were made? Here is your chance with this package which contains all 3 Hacker Evolution games and their source code: Hacker Evolution (game + source code) Hacker Evolution Untold (game + source code) Hacker Evolution Duality (game + source code) The 3 source code projects will compile and run from within Visual Studio 2010 and are written in simple to understand C/C++. Upon purchasing the source code you will also receive unlimited support via email directly from the lead developer. More information on each of the individual games: / / /,25,249.75,13,3156,0,True,2015
